<?xml version="1.0" encoding="UTF-8" ?>

<site-conf xmlns:xsi="http://www.w3.org/2001/XMLSchema-instance" xsi:noNamespaceSchemaLocation="http://www.ofbiz.org/dtds/site-conf.xsd">
	<errorpage>/view/error/error.jsp</errorpage>

	<handler name="screen" type="view" class="org.ofbiz.widget.screen.ScreenWidgetViewHandler" />

	<request-map uri="main">
		<security https="true" auth="true" />
		<response name="success" type="view" value="home" />
	</request-map>	
	
	<view-map name="error" page="/view/error/defaultError.jsp" />
	<view-map name="home" type="screen" page="component://mailer/widget/MailerScreens.xml#home" />	
	<!-- end of view mappings -->
</site-conf>